{
  "$schema": "https://json-schema.org/draft/2020-12/schema",
  "title": "station_nodes",
  "type": "array",
  "items": {
    "type": "object",
    "required": ["id", "name_en", "operator_id", "lat", "lon"],
    "additionalProperties": true,
    "properties": {
      "id": { "type": "string" },
      "name_en": { "type": "string" },
      "name_ja": { "type": "string" },
      "operator_id": { "type": "string" },
      "lat": { "type": "number" },
      "lon": { "type": "number" },
      "line_hint": { "type": "string" }
    }
  }
}
