[
  {
    "id": "node-C01-osaka-metro",
    "name_en": "Yumeshima",
    "name_ja": "夢洲",
    "operator_id": "osaka-metro",
    "lat": 34.6529239,
    "lon": 135.3905899
  },
  {
    "id": "node-C02-osaka-metro",
    "name_en": "Cosmo Square",
    "name_ja": "コスモスクエア",
    "operator_id": "osaka-metro",
    "lat": 34.6426716,
    "lon": 135.4121727
  },
  {
    "id": "node-C03-osaka-metro",
    "name_en": "Ōsakakō",
    "name_ja": "大阪港",
    "operator_id": "osaka-metro",
    "lat": 34.6539654,
    "lon": 135.4344007
  },
  {
    "id": "node-C04-osaka-metro",
    "name_en": "Asashiobashi",
    "name_ja": "朝潮橋",
    "operator_id": "osaka-metro",
    "lat": 34.66087,
    "lon": 135.448799
  },
  {
    "id": "node-C05-osaka-metro",
    "name_en": "Bentencho",
    "name_ja": "弁天町",
    "operator_id": "osaka-metro",
    "lat": 34.6684336,
    "lon": 135.4620861
  },
  {
    "id": "node-C06-osaka-metro",
    "name_en": "Kujō",
    "name_ja": "九条",
    "operator_id": "osaka-metro",
    "lat": 34.675318,
    "lon": 135.473524
  },
  {
    "id": "node-C07-osaka-metro",
    "name_en": "Awaza",
    "name_ja": "阿波座",
    "operator_id": "osaka-metro",
    "lat": 34.6813788,
    "lon": 135.488091
  },
  {
    "id": "node-C08-osaka-metro",
    "name_en": "Hommachi",
    "name_ja": "本町",
    "operator_id": "osaka-metro",
    "lat": 34.6820385,
    "lon": 135.49872
  },
  {
    "id": "node-C09-osaka-metro",
    "name_en": "Sakaisuji-Hommachi",
    "name_ja": "堺筋本町",
    "operator_id": "osaka-metro",
    "lat": 34.6818955,
    "lon": 135.5069338
  },
  {
    "id": "node-C10-osaka-metro",
    "name_en": "Tanimachi 4-chome",
    "name_ja": "谷町四丁目",
    "operator_id": "osaka-metro",
    "lat": 34.6814704,
    "lon": 135.5174698
  },
  {
    "id": "node-C11-osaka-metro",
    "name_en": "Morinomiya",
    "name_ja": "森ノ宮",
    "operator_id": "osaka-metro",
    "lat": 34.6814987,
    "lon": 135.5320338
  },
  {
    "id": "node-C12-osaka-metro",
    "name_en": "Midoribashi",
    "name_ja": "緑橋",
    "operator_id": "osaka-metro",
    "lat": 34.6806757,
    "lon": 135.5457466
  },
  {
    "id": "node-C13-osaka-metro",
    "name_en": "Fukaebashi",
    "name_ja": "深江橋",
    "operator_id": "osaka-metro",
    "lat": 34.6791315,
    "lon": 135.5574567
  },
  {
    "id": "node-C14-osaka-metro",
    "name_en": "Takaida",
    "name_ja": "高井田",
    "operator_id": "osaka-metro",
    "lat": 34.6784001,
    "lon": 135.5719206
  },
  {
    "id": "node-C15-osaka-metro",
    "name_en": "Nagata",
    "name_ja": "長田",
    "operator_id": "osaka-metro",
    "lat": 34.6787791,
    "lon": 135.5910607
  },
  {
    "id": "node-I01-osaka-metro",
    "name_en": "Imazato",
    "name_ja": "今里",
    "operator_id": "osaka-metro",
    "lat": 34.6701679,
    "lon": 135.5430271
  },
  {
    "id": "node-I02-osaka-metro",
    "name_en": "Midoribashi",
    "name_ja": "緑橋",
    "operator_id": "osaka-metro",
    "lat": 34.6814459,
    "lon": 135.5445946
  },
  {
    "id": "node-I03-osaka-metro",
    "name_en": "Shigino",
    "name_ja": "鴫野",
    "operator_id": "osaka-metro",
    "lat": 34.6930286,
    "lon": 135.546139
  },
  {
    "id": "node-I04-osaka-metro",
    "name_en": "Gamo 4-chome",
    "name_ja": "蒲生四丁目",
    "operator_id": "osaka-metro",
    "lat": 34.7009642,
    "lon": 135.5462694
  },
  {
    "id": "node-I05-osaka-metro",
    "name_en": "Sekime-Seiiku",
    "name_ja": "関目成育",
    "operator_id": "osaka-metro",
    "lat": 34.7130898,
    "lon": 135.5464176
  },
  {
    "id": "node-I06-osaka-metro",
    "name_en": "Shimmori-Furuichi",
    "name_ja": "新森古市",
    "operator_id": "osaka-metro",
    "lat": 34.7152855,
    "lon": 135.5583018
  },
  {
    "id": "node-I07-osaka-metro",
    "name_en": "Shimizu",
    "name_ja": "清水",
    "operator_id": "osaka-metro",
    "lat": 34.7222702,
    "lon": 135.5607758
  },
  {
    "id": "node-I08-osaka-metro",
    "name_en": "Taishibashi-Imaichi",
    "name_ja": "太子橋今市",
    "operator_id": "osaka-metro",
    "lat": 34.7312741,
    "lon": 135.5562082
  },
  {
    "id": "node-I09-osaka-metro",
    "name_en": "Daido-Toyosato",
    "name_ja": "だいどう豊里",
    "operator_id": "osaka-metro",
    "lat": 34.7439168,
    "lon": 135.5445246
  },
  {
    "id": "node-I10-osaka-metro",
    "name_en": "Zuiko 4-chome",
    "name_ja": "瑞光四丁目",
    "operator_id": "osaka-metro",
    "lat": 34.7522157,
    "lon": 135.5445284
  },
  {
    "id": "node-I11-osaka-metro",
    "name_en": "Itakano",
    "name_ja": "井高野",
    "operator_id": "osaka-metro",
    "lat": 34.7600039,
    "lon": 135.5472368
  },
  {
    "id": "node-K01-osaka-metro",
    "name_en": "Tenjinbashisuji 6-chome",
    "name_ja": "天神橋筋六丁目",
    "operator_id": "osaka-metro",
    "lat": 34.7098099,
    "lon": 135.5108581
  },
  {
    "id": "node-K02-osaka-metro",
    "name_en": "Ogimachi",
    "name_ja": "扇町",
    "operator_id": "osaka-metro",
    "lat": 34.7044749,
    "lon": 135.5108719
  },
  {
    "id": "node-K03-osaka-metro",
    "name_en": "Minami-morimachi;Minami-Morimachi",
    "name_ja": "南森町",
    "operator_id": "osaka-metro",
    "lat": 34.6975768,
    "lon": 135.5110359
  },
  {
    "id": "node-K04-osaka-metro",
    "name_en": "Kitahama",
    "name_ja": "北浜",
    "operator_id": "osaka-metro",
    "lat": 34.6911709,
    "lon": 135.5066098
  },
  {
    "id": "node-K05-osaka-metro",
    "name_en": "Sakaisuji-Hommachi",
    "name_ja": "堺筋本町",
    "operator_id": "osaka-metro",
    "lat": 34.6826169,
    "lon": 135.5064858
  },
  {
    "id": "node-K06-osaka-metro",
    "name_en": "Nagahoribashi",
    "name_ja": "長堀橋",
    "operator_id": "osaka-metro",
    "lat": 34.6748567,
    "lon": 135.5063511
  },
  {
    "id": "node-K07-osaka-metro",
    "name_en": "Nippombashi",
    "name_ja": "日本橋",
    "operator_id": "osaka-metro",
    "lat": 34.6667178,
    "lon": 135.5061814
  },
  {
    "id": "node-K08-osaka-metro",
    "name_en": "Ebisucho",
    "name_ja": "恵美須町",
    "operator_id": "osaka-metro",
    "lat": 34.6555986,
    "lon": 135.5056863
  },
  {
    "id": "node-K09-osaka-metro",
    "name_en": "Dobutsuen-mae",
    "name_ja": "動物園前",
    "operator_id": "osaka-metro",
    "lat": 34.6486554,
    "lon": 135.5035793
  },
  {
    "id": "node-K10-osaka-metro",
    "name_en": "Tengachaya",
    "name_ja": "天下茶屋",
    "operator_id": "osaka-metro",
    "lat": 34.6376745,
    "lon": 135.4971668
  },
  {
    "id": "node-M01-osaka-metro",
    "name_en": "Minoh-kayano",
    "name_ja": "箕面萱野",
    "operator_id": "osaka-metro",
    "lat": 34.8313768,
    "lon": 135.4891286
  },
  {
    "id": "node-M02-osaka-metro",
    "name_en": "Minoh-semba handai-mae",
    "name_ja": "箕面船場阪大前",
    "operator_id": "osaka-metro",
    "lat": 34.8218342,
    "lon": 135.4902827
  },
  {
    "id": "node-M03-osaka-metro",
    "name_en": "Senri-Chūō",
    "name_ja": "千里中央",
    "operator_id": "osaka-metro",
    "lat": 34.8098942,
    "lon": 135.495112
  },
  {
    "id": "node-M04-osaka-metro",
    "name_en": "Momoyamadai",
    "name_ja": "桃山台",
    "operator_id": "osaka-metro",
    "lat": 34.7931201,
    "lon": 135.497377
  },
  {
    "id": "node-M05-osaka-metro",
    "name_en": "Ryokuchi-kōen",
    "name_ja": "緑地公園",
    "operator_id": "osaka-metro",
    "lat": 34.7754202,
    "lon": 135.4954007
  },
  {
    "id": "node-M06-osaka-metro",
    "name_en": "Esaka",
    "name_ja": "江坂",
    "operator_id": "osaka-metro",
    "lat": 34.7588638,
    "lon": 135.4971624
  },
  {
    "id": "node-M07-osaka-metro",
    "name_en": "Higashi-Mikuni",
    "name_ja": "東三国",
    "operator_id": "osaka-metro",
    "lat": 34.7411464,
    "lon": 135.4985642
  },
  {
    "id": "node-M08-osaka-metro",
    "name_en": "Shin-Osaka",
    "name_ja": "新大阪",
    "operator_id": "osaka-metro",
    "lat": 34.7328996,
    "lon": 135.4986181
  },
  {
    "id": "node-M09-osaka-metro",
    "name_en": "Nishinakajima-Minamigata",
    "name_ja": "西中島南方",
    "operator_id": "osaka-metro",
    "lat": 34.7266367,
    "lon": 135.4986182
  },
  {
    "id": "node-M10-osaka-metro",
    "name_en": "Nakatsu",
    "name_ja": "中津",
    "operator_id": "osaka-metro",
    "lat": 34.711026,
    "lon": 135.4968501
  },
  {
    "id": "node-M11-osaka-metro",
    "name_en": "Umeda",
    "name_ja": "梅田",
    "operator_id": "osaka-metro",
    "lat": 34.7034172,
    "lon": 135.4976136
  },
  {
    "id": "node-M12-osaka-metro",
    "name_en": "Yodoyabashi",
    "name_ja": "淀屋橋",
    "operator_id": "osaka-metro",
    "lat": 34.6916379,
    "lon": 135.5009817
  },
  {
    "id": "node-M13-osaka-metro",
    "name_en": "Hommachi",
    "name_ja": "本町",
    "operator_id": "osaka-metro",
    "lat": 34.6835415,
    "lon": 135.5006949
  },
  {
    "id": "node-M14-osaka-metro",
    "name_en": "Shinsaibashi",
    "name_ja": "心斎橋",
    "operator_id": "osaka-metro",
    "lat": 34.6745178,
    "lon": 135.5003852
  },
  {
    "id": "node-M15-osaka-metro",
    "name_en": "Namba",
    "name_ja": "なんば",
    "operator_id": "osaka-metro",
    "lat": 34.6661554,
    "lon": 135.5002995
  },
  {
    "id": "node-M16-osaka-metro",
    "name_en": "Daikokucho",
    "name_ja": "大国町",
    "operator_id": "osaka-metro",
    "lat": 34.6562418,
    "lon": 135.4979568
  },
  {
    "id": "node-M17-osaka-metro",
    "name_en": "Dobutsuen-mae",
    "name_ja": "動物園前",
    "operator_id": "osaka-metro",
    "lat": 34.6488146,
    "lon": 135.5045554
  },
  {
    "id": "node-M18-osaka-metro",
    "name_en": "Tennoji",
    "name_ja": "天王寺",
    "operator_id": "osaka-metro",
    "lat": 34.6460991,
    "lon": 135.515278
  },
  {
    "id": "node-M19-osaka-metro",
    "name_en": "Showacho",
    "name_ja": "昭和町",
    "operator_id": "osaka-metro",
    "lat": 34.6331228,
    "lon": 135.5169549
  },
  {
    "id": "node-M20-osaka-metro",
    "name_en": "Nishi-Tanabe",
    "name_ja": "西田辺",
    "operator_id": "osaka-metro",
    "lat": 34.6215517,
    "lon": 135.5151872
  },
  {
    "id": "node-M21-osaka-metro",
    "name_en": "Nagai",
    "name_ja": "長居",
    "operator_id": "osaka-metro",
    "lat": 34.6090138,
    "lon": 135.5137176
  },